question,correctAnswer,exp
האם ניתן להשיג את מטרת הדיון בדרך אחרת?,no,"לעיתים דיון פנים אל פנים הוא הדרך היחידה להגיע להבנה מלאה ולפתרון מקובל על כל הצדדים"
האם יש להזמין רק את הנדרשים לדיון?,yes,"הזמנת אנשים לא רלוונטיים עלולה להסיח את הדעת ולפגוע ביעילות הדיון"
האם אי-מענה לאישור השתתפות הוא מקובל?,no,"אישור השתתפות הוא חלק מאחריות מקצועית ומראה כבוד למארגני הדיון"
האם סיכום ומשימות נדרשים בסוף הדיון?,yes,"סיכום ברור מבטיח שכולם יצאו עם אותה הבנה ותוכנית פעולה"
האם שיח לא מכבד דורש הפסקת דיון?,yes,"שיח לא מכבד פוגע באפקטיביות הדיון ויכול ליצור מתחים מיותרים"
האם יש צורך בהסבר מפורט לפני הדיון?,yes,"הסבר מקדים מבטיח שכולם מגיעים מוכנים עם אותה הבנה בסיסית"
האם יש להגביל את זמן ההשתתפות בדיון?,yes,"הגבלת זמן עוזרת לשמור על דיון ממוקד ופרודוקטיבי"
האם דיון ללא מטרות ברורות הוא אפקטיבי?,no,"מטרות ברורות הן תנאי הכרחי לדיון מוצלח ותוצאות מעשיות"
האם יש לשמור על כבוד הדדי בדיון?,yes,"כבוד הדדי הוא הבסיס לכל דיון פורה ומכבד"
האם יש לדחות דיונים ללא נוכחות חיונית?,yes,"נוכחות של בעלי תפקידים מרכזיים היא קריטית לקבלת החלטות"
האם יש לקבוע תאריך חדש אם אין מספיק משתתפים?,yes,"דחייה עד להגעה למניין מספק מבטיחה שהחלטות יתקבלו באופן מייצג"
האם יש לעדכן את המשתתפים לגבי תוצאות הדיון?,yes,"עדכון שומר על שקיפות ומבטיח יישום של ההחלטות"
האם יש להימנע מדיבור אחד מול השני?,yes,"דיבור דרך המנחה שומר על סדר ומיקוד בדיון"
האם יש להגביל את מספר המילים לכל משתתף?,no,"הגבלת ביטוי עלולה למנוע חשיפת רעיונות חשובים, אך יש לשמור על רלוונטיות"
האם יש לשמור על דיון פתוח לכל השאלות?,yes,"שאלות פתוחות מעודדות הבנה מעמיקה יותר של הנושא"
האם יש לתת עדיפות לדעות של מומחים?,yes,"למומחים יש תובנות חשובות, אך יש לשמוע גם את כל הדעות הרלוונטיות"
האם יש להקפיד על זמן הדיון?,yes,"שמירה על לוח זמנים מבטיחה כיבוד זמן המשתתפים ומיקוד בנושא"
האם יש להימנע מדיבורים אישיים בדיון?,yes,"דיונים צריכים להתמקד בתוכן מקצועי ולא בעניינים אישיים"
האם יש להקליט את הדיון לצורך תיעוד?,yes,"תיעוד עוזר למי שלא השתתף ולצורך הבהרות עתידיות"
האם יש להימנע מדעות קיצוניות בדיון?,no,"כל הדעות רלוונטיות, אך יש לבטאן בצורה מכבדת ומנומקת"
האם יש לשמור על נושאים רלוונטיים בלבד?,yes,"יציאה מהנושא פוגעת ביעילות הדיון"
האם יש לתת אפשרות להצבעה בדיון?,yes,"הצבעה היא כלי חשוב לקבלת החלטות כאשר אין הסכמה"
האם יש להימנע מהפרעות חיצוניות?,yes,"הפרעות פוגעות בריכוז וברצף הדיון"
האם יש לקיים דיון בכל נושא שהועלה?,no,"יש להתמקד בנושאים התורמים ישירות למטרת הדיון"
האם יש לתת משוב לאחר הדיון?,yes,"משוב עוזר לשיפור תהליכי דיון עתידיים"
האם יש להציג את התוצאות באופן ציבורי?,yes,"שקיפות מבטיחה אמון ומחויבות לתוצאות"
האם יש להימנע ממחלוקות אישיות?,yes,"מחלוקות צריכות להיות מקצועיות וענייניות"
האם יש לקבוע תקנון לדיון?,yes,"תקנון ברור מונע אי-הבנות ושומר על אווירה מכבדת"
האם יש לשמור על שקיפות בדיון?,yes,"שקיפות בונה אמון ומחויבות לתוצאות"
האם יש להימנע מלחץ זמן?,no,"לחץ זמן מבוקר יכול לסייע בשמירה על מיקוד"
האם יש לתת פידבק לכל משתתף?,yes,"פידבק אישי מעודד השתתפות פעילה בדיונים עתידיים"
האם יש להימנע מדעות שגויות?,no,"יש לאפשר הצגת כל הדעות ולתקן שגיאות בצורה מכבדת"
האם יש לקיים דיון גם ללא הסכמה?,yes,"דיון הוא כלי חשוב לגישור על פערים ולמציאת פתרונות"
האם יש להימנע מתגובות חריפות?,yes,"תגובות צריכות להיות ענייניות ומכבדות גם בעת חילוקי דעות"
האם יש לשמור על נקודת מבט מאוזנת?,yes,"איזון מבטיח שכל הצדדים יישמעו וההחלטות יהיו מושכלות"